commit	val_bpb	memory_gb	mfu	tok_per_sec	num_steps	num_params_M	batch_size	final_loss	status	description
7be5ed2	0.882488	9.8	81.1	53000	1466	229.0	4	2.563	discard	global gradient norm clipping max_norm=1.0 (hypothesis: prevent gradient spikes that waste optimizer steps; evidence: standard in GPT-2/3/Llama training): val_bpb 0.8825→0.8825 IDENTICAL within noise (0.000003) — Muon Newton-Schulz already normalizes matrix param gradients; AdamW embedding params show no spike issues. Gradient clipping is redundant with Muon optimizer
3031cc6	0.881993	9.9	83.7	55000	1511	229.0	4	2.589	discard	partial RoPE 50%→25% (rotary_dim head_dim//4 instead of //2; hypothesis: more content-based dims help since 0→50% gave +0.004; evidence: extrapolating direction): val_bpb 0.8825→0.8820 MARGINAL 0.0005 below 0.002 threshold — throughput improved (198M vs 189M tokens 83.7% vs 83.2% MFU) from less RoPE compute but quality per step degraded. Optimal partial RoPE is near 50% not lower. Too little positional info (32/128 dims) hurts attention quality; 50% is the sweet spot
1516e1f	0.882018	10.1	82.1	52000	1482	235.3	4	2.633	discard	bigram hash embedding nn.Embedding(8192,768) hash=(36313*cur)^(27191*prev)%8192 added to wte output (hypothesis: learned bigram representations improve data efficiency; evidence: modded-nanogpt Record #62 biggest single quality win -8.5%): val_bpb 0.8825→0.8820 MARGINAL 0.0005 below 0.002 threshold — 6.3M extra params (235.3M total) and similar throughput (194M vs 189M tokens) but quality per step unchanged. Bigram info already captured by token shift channel mixing. Hash table 8192 may also be too sparse for 50257-token vocab (2.5B possible bigrams)
f868679	0.000000	0.0	0.0	0	0	0.0	0	0.000	crash	batch size schedule half batch 2^16 first 30% then full 2^17 (hypothesis: more optimizer steps early improves convergence; evidence: modded-nanogpt Record #46): CRASH — scoping bug total_tokens_processed not available in eval section; first run showed 1838 steps (27% more than baseline) but crashed before eval. Concept viable but needs proper implementation
5c5a00f	0.878393	9.6	84.3	54800	1517	229.0	4	2.570	keep	Muon beta2 0.95→0.98 (hypothesis: smoother gradient normalization improves convergence in ~1500 steps; evidence: Karpathy autoresearch found beta2=0.98 helped): val_bpb 0.8825→0.8784 IMPROVED by 0.0041 — higher beta2 EMA half-life 14→35 steps provides more stable update scaling throughout training; throughput slightly improved (198M vs 189M tokens 84.3 vs 83.2% MFU) suggesting better compile behavior; biggest improvement in 25+ experiments
7394e97	0.880972	11.1	80.2	52300	1448	229.1	4	2.620	discard	learnable logit_shift after softcap (hypothesis: frees model capacity from learning unigram distribution; evidence: modded-nanogpt logit shift technique): val_bpb 0.8784→0.8810 WORSE by 0.0026 — 4.7% MFU drop (84.3→80.2%) from unbounded logit_shift breaking torch.compile optimization yielding 4.5% fewer tokens (189.8M vs 198.8M); VRAM spiked 9.8→11.4GB; throughput cost outweighed any quality benefit
aa7df20	0.885969	9.6	84.0	54800	1516	229.0	4	2.610	discard	Muon final momentum 0.95→0.975 (hypothesis: faster convergence with smoother beta2=0.98; evidence: standard optimizers use 0.9-0.99): val_bpb 0.8784→0.8860 WORSE by 0.008 — higher momentum causes overshooting during warmdown phase; loss trajectory shows higher train loss throughout (3.34 vs 3.21 at step 290; 2.61 vs 2.57 final). Momentum 0.95 is optimal ceiling with beta2=0.98
52f5323	0.882230	9.6	84.0	54700	1516	229.0	4	2.600	discard	WD schedule: constant 0.1 during warmup+peak then decay to 0 during warmdown (hypothesis: maintain regularization during exploration; evidence: constant-WD-full-training was worse suggesting decay needed, but WHEN to decay matters): val_bpb 0.8784→0.8822 WORSE by 0.004 — higher WD during peak (0.1 vs 0.05-0.1 linear decay) constrains learning too much; training loss higher throughout (3.43 vs 3.21 at step 290). Linear WD decay from start is better — gradual relaxation of regularization is optimal
0c2e2d6	0.876835	9.6	84.0	54800	1516	229.0	4	2.590	discard	AdamW beta2 0.95→0.98 for embedding/lm_head params (hypothesis: smoother gradient normalization mirrors successful Muon beta2 change; evidence: Muon beta2 0.95→0.98 gave +0.0041): val_bpb 0.8784→0.8768 MARGINAL 0.0016 below 0.002 threshold — directionally correct but not reliably distinguishable from variance. AdamW second moment smoothing helps less than Muon's because embeddings have less gradient noise than matrix params
9920521	0.892600	8.4	73.3	54800	1339	229.0	4	2.863	discard	WEIGHT_DECAY 0.1→0.05 (hypothesis: lower WD helps undertrained regime 0.87 tok/param; evidence: WD 0.5 catastrophic so tried lower): val_bpb 0.8784→0.8926 WORSE by 0.014 — GPU throttled badly last 10 steps (MFU 84→5%) corrupting final loss/warmdown. But even early steps showed worse val trajectory. Lower WD lets model overfit to training data without improving generalization; regularization at 0.1 is needed even when undertrained
5fb278a	0.886347	10.3	82.2	53500	1482	229.0	4	2.638	discard	norm(v) added to attention QKV normalization (hypothesis: V-norm completes HybridNorm QKV stabilization; evidence: HybridNorm arxiv 2503.04598): val_bpb 0.8784→0.8863 WORSE by 0.008 — value normalization removes scale information the attention weighted sum relies on; different value tokens SHOULD have different magnitudes for expressive output. V-norm also dropped MFU 84.3→82.2% (torch.compile interaction) yielding 2% fewer tokens
77bc809	0.885228	10.2	80.5	52400	1450	230.6	4	2.575	discard	learned position embeddings nn.Embedding(2048,768) added to wte output (hypothesis: complement partial RoPE 50% with absolute position info for non-RoPE dims; evidence: partial RoPE improved +0.004 showing position matters): val_bpb 0.8784→0.8852 WORSE by 0.007 — absolute position embeddings conflict with RoPE relative encoding; MFU dropped 84→80.5% (4% fewer tokens 190M vs 198M) and quality per step degraded. Learned positions redundant: RoPE already provides position AND non-RoPE dims benefit from being position-FREE for content matching
601f9a5	0.881822	9.8	83.6	54400	1507	229.0	4	2.540	discard	backout lambda init=0.2 at layer 8/16 (hypothesis: subtract mid-layer residual forces later layers to produce incremental features; evidence: nanochat uses this): val_bpb 0.8784→0.8818 WORSE by 0.003 — near-zero throughput cost (83.6 vs 84.3% MFU 197.5M vs 198M tokens) but quality per step slightly degraded. With Peri-LN already normalizing sublayer outputs the residual stream is well-conditioned; subtracting mid-layer info removes useful features. Backout might work better without Peri-LN
ba1a342	0.874235	10.3	82.6	53700	1488	229.0	4	2.584	keep	gated value embedding: gate=3*sigmoid(Linear(x[:12])→n_heads) per-head per-token (hypothesis: input-dependent gating on ve improves over static v+ve addition; evidence: nanochat uses this with 12-channel gate): val_bpb 0.8784→0.8742 IMPROVED by 0.0042 — zero-init gate gives initial scale 1.5x; model learns to modulate ve contribution per head/token. Minimal overhead (72 params/layer 82.6 vs 84.3% MFU 195M vs 198M tokens). Breaks 8-experiment plateau!
bfd2322	0.881045	10.2	83.3	54200	1498	229.0	4	2.613	discard	QK attention sharpening q*1.2 k*1.2 after norm (hypothesis: sharper attention focuses on relevant tokens; evidence: nanochat uses q*1.2 k*1.2): val_bpb 0.8742→0.8810 WORSE by 0.007 — 1.44x sharper attention makes model overfocus; soft attention distribution is better for 229M model. Good throughput (83.3% MFU 196M tokens) but quality per step degraded. QK-norm + partial RoPE already provides well-calibrated attention temperature
bb4e3df	0.881938	10.2	83.9	54500	759	229.0	4	2.680	discard	TOTAL_BATCH_SIZE 2^17→2^18 (hypothesis: 2x larger batch = cleaner gradients despite halved steps; evidence: 2^16 was worse so tried opposite direction): val_bpb 0.8742→0.8819 WORSE by 0.008 — same total tokens (199M) but only 759 steps vs ~1488; halved optimizer updates hurts convergence. 2^17 is the sweet spot: enough steps for learning dynamics AND enough batch size for gradient quality
cc2c839	0.881233	10.3	78.4	50304	1414	229.0	4	2.550	discard	attention sink tokens n_sink=4 in sliding window (hypothesis: S-layers 12/16 lack global context; Streaming LLM shows first tokens are attention sinks; evidence: SSSL pattern means 75% layers see only 256 tokens): val_bpb 0.8742→0.8812 WORSE by 0.007 — MFU dropped 82.6→78.4% yielding 5% fewer tokens (185M vs 195M); flex_attention overhead from sink mask. Near-zero cost assumption was WRONG — sink tokens in block mask add significant compile/runtime overhead
91cca33	0.876401	10.2	83.0	53410	1480	229.0	4	2.687	discard	multi-resolution RoPE per-head bases log-spaced 2000-150000 (hypothesis: varied base frequencies create multi-scale attention for diverse distance encoding; evidence: YaRN/multi-scale RoPE literature + SSSL S-layers limited to 256 tokens): val_bpb 0.8742→0.8764 WORSE by 0.0022 — uniform base=10000 already optimal; extreme bases (2000 and 150000) hurt: low base compresses position info too much, high base makes RoPE nearly constant (content-only). Same throughput 83% MFU 194M tokens. Per-head frequency diversity not beneficial when partial RoPE 50% already provides position/content split
9337360	0.915033	10.3	82.4	53400	1477	229.0	4	2.777	discard	NormHead: F.normalize(lm_head.weight) for cosine similarity logits (hypothesis: decouple token frequency from semantic direction; evidence: NormHead used in InternLM/Qwen): val_bpb 0.8742→0.9150 CATASTROPHICALLY WORSE by 0.041 — cosine-similarity-only logits remove the model's ability to encode token frequency in weight norms. With softcap=15 already bounding logits, NormHead over-constrains the output layer. Training loss 2.78 vs 2.65 baseline shows underfitting. The lm_head needs weight norm freedom to learn unigram/frequency priors
86ba843	0.876928	10.2	82.4	53400	1894	229.0	4	2.529	discard	batch size schedule: half batch (2^16) first 30% then full (2^17) for 28% more optimizer steps (hypothesis: more exploration steps early improves convergence; evidence: modded-nanogpt Record #46): val_bpb 0.8742→0.8769 WORSE by 0.003 — 1894 total steps but only 191.5M tokens (vs 194M baseline); noisier gradients from half-batch early phase did NOT improve exploration enough to compensate; the model benefits more from clean full-batch gradients from the start. TOTAL_BATCH_SIZE 2^17 is optimal throughout
a2b1b5d	0.875636	10.4	82.5	53400	1477	229.0	4	2.698	discard	MLP token shift: extend token shift to MLP input (hypothesis: MLP benefits from prev position post-attn features like attention does; evidence: token shift for attention improved +0.0046): val_bpb 0.8742→0.8756 WORSE by 0.0014 noise-level — MLP already gets indirect local context through attention output; explicit shift is redundant. Extra torch.roll+cat slightly hurt throughput (193.6M vs 195M tokens 82.5 vs 84.3% MFU). Token shift only helps at the attention input stage where local context isn't yet available
b4ff3fc	1.002566	10.9	82.4	53400	1476	229.0	4	2.699	discard	EMA model weights decay=0.999 for eval (hypothesis: averaging smooths training noise for better generalization; evidence: used in DeepSeek/Llama): val_bpb 0.8742→1.0026 CATASTROPHICALLY WORSE by 0.128 — decay=0.999 with only ~1476 steps means effective averaging window spans 68% of training INCLUDING poorly-trained early steps. EMA model is a diluted average that barely converges. EMA needs either (a) much higher decay (0.9999) to average only recent steps or (b) much longer training. VRAM also spiked 10.2→11.2GB from storing weight copies
3d3fe7d	0.926995	10.9	81.5	52690	1461	229.0	4	2.528	discard	late-start EMA decay=0.999 warmdown-only (hypothesis: starting EMA late avoids polluting with early undertrained weights; evidence: prior EMA exp val_bpb 1.003 from full-training averaging): val_bpb 0.8742→0.9270 STILL CATASTROPHICALLY WORSE by 0.053 — even warmdown-only EMA (last ~40% of training) heavily dilutes the final well-trained weights. With 1461 steps the warmdown covers ~584 steps; exponential averaging at 0.999 gives effective window of ~1000 steps which reaches BACK into pre-warmdown territory. EMA fundamentally incompatible with short training runs. Conclusively rules out EMA at this training scale
8578c97	0.897892	11.3	72.7	47615	1312	229.1	4	2.644	discard	differential attention (ICLR 2025): split Q,K→Q1,Q2,K1,K2 (sub_head_dim=64), y=(1-λ_init)*(SDPA(Q1,K1,V)-λ*SDPA(Q2,K2,V)) (hypothesis: noise cancellation from subtracting two softmax maps improves signal quality; evidence: ICLR 2025 oral, 65% model size for equiv quality): val_bpb 0.8742→0.8979 WORSE by 0.024 — two SDPA calls per layer dropped throughput 194M→172M tokens (73% vs 82% MFU) without quality gain. The 12% fewer tokens offset any noise-cancellation benefit. At this short training budget (1312 steps), token throughput dominates — diff attention trades compute for quality, but with only 60min the compute loss hurts more than the quality gain helps. Also VRAM spiked to 11.3GB (near limit). Diff attention needs longer training to amortize its per-step quality advantage
1b3c263	0.884705	10.3	84.0	53418	1487	229.0	4	2.638	discard	learnable attn temperature: per-head attn_scale init=0.2 multiplied on Q after QK-norm (hypothesis: diffuse attention early prevents premature patterns; evidence: modded-nanogpt attn_scale_start=0.1): val_bpb 0.8742→0.8847 WORSE by 0.0105 — throughput preserved (195M tokens 84% MFU same as baseline) but quality per step degraded. attn_scale=0.2 means QK logits scaled to ~20% of normal range early in training which made attention too uniform for too long. The model needs sharp attention from the start at this scale to learn position-dependent features efficiently. Different from modded-nanogpt which has 10 layers and higher LR — our 16-layer Peri-LN+QK-norm already provides sufficient attention regularization
025be1a	0.871688	10.1	82.3	53746	1483	229.0	4	2.629	keep	WARMDOWN_RATIO 0.5→0.7 (hypothesis: longer cosine decay phase helps convergence; evidence: WARMDOWN 0.3 was -0.010 catastrophic, 0.5 was best, trend suggests longer=better): val_bpb 0.8742→0.8717 IMPROVED by 0.0025 — confirms the trend: model benefits from extended convergence phase. With 70% warmdown the LR starts decaying at 30% progress vs 50%, giving 40% more steps in warmdown. Same throughput (194M tokens 82.3% MFU) proves this is pure schedule optimization. Breaks 7-experiment plateau!
65a4d25	0.873316	10.1	81.6	53805	1471	229.0	4	2.644	discard	WARMDOWN_RATIO 0.7→0.8 (hypothesis: continuing 0.3→0.5→0.7 improvement trend; evidence: each step improved so far): val_bpb 0.8717→0.8733 WORSE by 0.0016 noise-level — diminishing returns hit. 80% warmdown leaves only 15% of training at peak LR which is insufficient for exploration. The model needs at least ~25% constant-LR phase (as in WARMDOWN 0.7). Optimal warmdown is 0.7 — longer helps convergence but too long starves exploration
464024f	0.871386	10.2	82.5	53693	1487	229.0	4	2.577	discard	WEIGHT_DECAY 0.1→0.15 with existing CWD (hypothesis: slightly stronger regularization helps generalization; evidence: WD 0.05 worse WD 0.5 catastrophic pre-CWD; modded-nanogpt uses 1.2): val_bpb 0.8717→0.8714 MARGINAL 0.0003 below 0.002 threshold — not reliably distinguishable from variance. WD 0.1 already optimal with CWD at this scale; increasing to 0.15 adds no benefit but doesn't hurt either. Same throughput (195M tokens 82.5% MFU). CWD makes WD changes less impactful since it's already selective
95c1221	0.874886	10.2	81.3	53521	1462	229.0	4	2.569	discard	resid_lambdas init 1.0→1.049 (=(1.1)^0.5 modded-nanogpt recipe; hypothesis: slight residual amplification improves gradient flow in 16 layers; evidence: modded-nanogpt WR recipe uses this init): val_bpb 0.8717→0.8749 WORSE by 0.003 — residual amplification hurts our Peri-LN setup where double-norm already balances residual vs sublayer magnitudes. The 1.049 init creates early training instability (higher initial loss 8.2 vs 7.8 typical) that the model doesn't fully recover from. MFU slightly lower (81.3 vs 82.3%). modded-nanogpt doesn't use Peri-LN so their resid scaling is compatible; ours conflicts
46b2f06	0.878307	10.2	81.2	53568	1457	229.0	4	2.620	discard	linear warmdown replacing cosine warmdown (hypothesis: linear distributes time evenly across LR values vs cosine spending most time at very low LR; evidence: WARMDOWN 0.7 worked so shape might matter too): val_bpb 0.8717→0.8783 WORSE by 0.007 — cosine shape is superior. The cosine's emphasis on very low LR at the end allows finer convergence; linear's equal-time distribution wastes warmdown steps at moderate LRs where the model isn't settling into minima. Cosine warmdown shape is optimal
4e3dc32	0.879663	10.1	84.1	54680	1512	229.0	4	2.581	discard	non-gated 4x MLP replacing SwiGLU 8/3x (hypothesis: fewer matmuls=more throughput at same params; evidence: plateau needs architecture change): val_bpb 0.8717→0.8797 WORSE by 0.008 — throughput improved (198M vs 194M tokens 84.1 vs 82.3% MFU 1512 vs 1483 steps) but quality per step significantly degraded. SwiGLU gating (silu(gate)*up) is essential for feature selection at this scale; non-gated MLP with 50% wider hidden (3072 vs 2048) cannot compensate. The gating mechanism provides learned sparsity that improves per-step learning efficiency more than the extra tokens help
d94a8cc	0.876547	10.2	82.6	53658	1486	229.0	4	2.631	discard	LAWA: average last 6 checkpoints from final 15% of training (hypothesis: smooth SGD noise for better generalization unlike failed EMA which averaged all weights; evidence: modded-nanogpt speedrun + DeepSeek + NeurIPS paper): val_bpb 0.8717→0.8765 WORSE by 0.005 — even late-only weight averaging hurts at ~1486 steps. The final checkpoint IS the most optimized point; averaging with earlier warmdown checkpoints undoes the precise convergence that cosine warmdown achieves. Same throughput (194.8M tokens 82.6% MFU). Weight averaging fundamentally conflicts with short training: the model improves meaningfully between every ~50 steps during warmdown so averaging dilutes the final optimized weights. Rules out ALL weight averaging at this training scale
1a75f05	0.931261	11.6	76.2	49540	1372	229.0	4	3.758	discard	label smoothing 0.1 training-only (hypothesis: regularization helps data-limited regime; evidence: standard technique, prev crash was impl bug): val_bpb 0.8717→0.9313 CATASTROPHICALLY WORSE by 0.060 — F.cross_entropy label_smoothing arg BREAKS torch.compile optimization: MFU crashed 82.3→76.2% yielding 8% fewer tokens (180M vs 194M), VRAM spiked 10.2→11.9GB (near 12GB limit), and quality per step degraded dramatically. Label smoothing creates a different autograd graph that torch.compile handles poorly — the smooth loss requires log_probs.mean() over V=50257 tokens changing gradient structure. Conclusively rules out PyTorch native label smoothing with torch.compile on this hardware
91cef19	0.000000	0.0	0.0	0	0	0.0	0	0.000	crash	disable activation checkpointing batch=4 (hypothesis: remove MLP recomputation for ~10-20% throughput; evidence: 1.8GB VRAM headroom): KILLED — compiled graph without checkpointing produced MFU 0.4% (200x slower than baseline). torch.compile cannot efficiently handle the full activation graph without checkpointing at this model size; either memory spills to system RAM or generates pathological kernel code. Activation checkpointing is ESSENTIAL for torch.compile performance on RTX 5070 12GB
810b6e3	0.874505	10.2	82.1	53800	1478	229.0	4	2.735	discard	MATRIX_LR 0.04→0.05 (hypothesis: Peri-LN stabilizes gradient flow allowing higher LR; evidence: 0.06 too high pre-Peri-LN, 0.03 marginal): val_bpb 0.8717→0.8745 WORSE by 0.003 — higher LR produces higher final training loss (2.735 vs 2.629) indicating slight overshooting. Same throughput (193.7M tokens 82.1% MFU 1478 steps). MATRIX_LR 0.04 confirmed optimal even with Peri-LN architecture; the gradient conditioning from Peri-LN doesn't shift the LR sweet spot upward
af7df18	0.881294	10.5	83.0	50871	1441	229.0	4	2.575	discard	parallel attn+MLP blocks PaLM/GPT-J style (hypothesis: parallel sublayers improve quality by removing sequential dependency; evidence: PaLM GPT-J use this successfully): val_bpb 0.8717→0.8813 WORSE by 0.010 — MLP needs attention-processed features not raw input. Sequential attn→MLP lets MLP refine attention output; parallel blocks force MLP to work on pre-attention features losing cross-position information. Throughput unchanged (189M vs 194M tokens 83 vs 82% MFU). At 16 layers with Peri-LN the sequential information flow is essential
07dfbf1	0.886264	11.4	84.0	43066	1207	257.4	4	2.693	discard	depth 16→20 layers ASPECT_RATIO 48→34 same dim=768 (hypothesis: 4 more layers increases representational depth for better feature learning at ~257M params; evidence: 12→16 was major improvement): val_bpb 0.8717→0.8863 WORSE by 0.015 — throughput dropped 19% (158M vs 194M tokens 1207 vs 1483 steps) from larger model. VRAM spiked 10.1→11.4GB near limit. Extra depth did NOT compensate for fewer tokens: at 60min budget token throughput dominates. The 16→20 layer jump needs proportionally more training time. Optimal depth for 60min/12GB is 16 layers — going deeper requires either more VRAM or longer training
8ea0ea0	0.000000	0.0	0.0	0	0	0.0	0	0.000	crash	MTP shared-weight aux head predicting t+2 via reused lm_head weight=0.15 (Nemotron 3 Super inspired; hypothesis: richer gradient signal from multi-token prediction; evidence: Nemotron+Meta MTP paper): KILLED — torch.compile produced pathological graph (MFU 0.4% = 472s/step). Second lm_head call with MXFP8 creates a compute graph torch.compile cannot optimize, same root cause as label smoothing failure. Any auxiliary loss that adds a second vocab-sized matmul in forward() is incompatible with torch.compile+MXFP8 on this hardware. Rules out ALL in-model auxiliary losses
