commit	val_bpb	memory_gb	mfu	tok_per_sec	num_steps	num_params_M	batch_size	final_loss	status	description
b34eb92	0.903214	9.8	85.7	67288	1910	200.7	4	3.129	keep	baseline (SwiGLU d12 768dim 6heads ~200M params Muon+AdamW ClimbMix 60min)
07fdf90	0.904431	9.8	90.0	68632	1928	200.7	4	3.335	discard	FINAL_LR_FRAC 0.1→0.0 full decay to zero (hypothesis: WSD-style full decay extracts more learning in warmdown; evidence: recent papers): val_bpb 0.9032→0.9044 WORSE by 0.0012 — partial LR at end is beneficial for this schedule
e31e34c	0.910353	9.7	86.4	70705	1912	200.7	4	3.106	discard	Newton-Schulz iterations 5→4 (hypothesis: fewer NS steps = more throughput = more tokens; evidence: Turbo-Muon research): val_bpb 0.9032→0.9104 WORSE by 0.007 — 5 NS steps needed for proper orthogonalization at this scale
5c35ca9	0.923120	9.7	87.4	70000	1918	200.7	4	3.115	discard	softcap 15→30 (hypothesis: softcap 15 too restrictive limits model confidence; evidence: modded-nanogpt uses ~23 and Gemma2 uses 30): val_bpb 0.9032→0.9231 WORSE by 0.020 — loss curve shows explosion near end of training suggesting looser cap causes instability during warmdown phase; softcap 15 is well-calibrated
f437c67	0.929601	9.6	86.2	70000	1921	200.7	4	3.069	discard	WEIGHT_DECAY 0.1→0.5 (hypothesis: stronger regularization improves generalization; evidence: slowrun shows heavy WD helps): val_bpb 0.9032→0.9296 WORSE by 0.026 — WD 0.5 way too aggressive for this setup; model underfits. Muon WD scaling differs from NorMuon
f85b618	0.900652	9.5	86.3	62500	1705	214.9	4	3.004	keep	depth 12→14 same width 768dim (ASPECT_RATIO 64→54 DEPTH 12→14; hypothesis: model capacity limits val_bpb after 4 failed hyperparameter changes; evidence: 2GB VRAM headroom unused): val_bpb 0.9032→0.9007 IMPROVED by 0.0026 despite 10% fewer steps (1705 vs 1910) — deeper model learns better representations per token
e037ae7	0.898653	9.6	88.7	57000	1587	229.0	4	2.632	keep	depth 14→16 same width 768dim (ASPECT_RATIO 54→48 DEPTH 14→16; hypothesis: deeper model = more capacity; evidence: depth 12→14 improved by 0.0026): val_bpb 0.9007→0.8987 IMPROVED by 0.0020 — deeper model continues to learn better per-token despite 7% fewer steps (1587 vs 1705)
3b86461	0.908793	9.5	89.9	57000	1606	229.0	4	2.843	discard	WARMDOWN_RATIO 0.5→0.3 (hypothesis: shorter cooldown gives more steps at peak LR; evidence: category switch after 2 arch changes): val_bpb 0.8987→0.9088 WORSE by 0.010 — model needs long 50% warmdown; shorter cooldown hurts final convergence significantly
4e585ec	0.910507	9.5	86.3	57000	3100	229.0	4	2.735	discard	TOTAL_BATCH_SIZE 2^17→2^16 (hypothesis: 2x more optimizer steps improves convergence; evidence: category rotation): val_bpb 0.8987→0.9105 WORSE by 0.012 — smaller batch = noisier gradients overwhelms benefit of more steps; 2^17 batch is well-tuned
a3a7e66	0.903281	9.9	89.7	52859	1464	243.2	4	2.559	discard	depth 16→18 same width 768dim (ASPECT_RATIO 48→42 DEPTH 16→18; hypothesis: deeper still = more capacity; evidence: d12→14 +0.0026 d14→16 +0.0020): val_bpb 0.8987→0.9033 WORSE by 0.0046 — diminishing returns hit; 16% fewer tokens (192M vs 208M) outweighs depth benefit. Depth 16 is optimal at 60min budget
19b15bb	0.910357	9.7	85.7	53016	1451	229.0	4	2.582	discard	WINDOW_PATTERN SSSL→SL (hypothesis: more full attention layers (8 vs 4) improve long-range context; evidence: plateau-forced architecture change): val_bpb 0.8987→0.9104 WORSE by 0.012 — throughput dropped 57k→53k tok/sec; 9% fewer tokens (190M vs 208M) not compensated by better attention. SSSL pattern is efficient — local attention handles most context
db2bc3b	0.910897	9.6	91.5	49522	1640	229.0	4	2.612	discard	HEAD_DIM 128→64 (12 heads instead of 6; hypothesis: more diverse attention patterns at same params; evidence: research on softmax saturation): val_bpb 0.8987→0.9109 WORSE by 0.012 — despite higher MFU 91.5% and more steps (1640 vs 1587), smaller head dim hurts quality. 128 head dim better for 768 width at this scale
415fe98	0.948409	10.0	78.5	51118	1417	229.0	4	2.659	discard	differential attention (split Q,K into 2x64 sub-heads, compute 2 SDPA, subtract; hypothesis: diff attn cancels noise in attention, 65% fewer tokens needed per paper; evidence: ICLR 2025 arxiv 2410.05258): val_bpb 0.8987→0.9484 WORSE by 0.050 — catastrophic. Throughput dropped 11% (57k→51k tok/sec) AND quality per token degraded. (1-lambda_init) scaling likely too aggressive for early layers (scale=0.2 at layer 0). Half-dim QK (64 vs 128) loses too much representational power. Paper's approach needs doubled Q,K projections (2x params) not just splitting existing ones
5f692d9	0.919411	9.6	89.0	56610	1606	229.0	4	2.871	discard	ReLU² activation replacing SiLU in gated MLP (hypothesis: sparser activations improve feature selection; evidence: modded-nanogpt speedrun uses ReLU²): val_bpb 0.8987→0.9194 WORSE by 0.021 — ReLU² significantly hurts quality at this scale despite equal throughput (210M vs 208M tokens). SiLU gating provides better gradient flow for 229M model. ReLU² may only help at 124M scale where modded-nanogpt operates
78bad6f	0.906469	9.6	89.0	57317	1581	229.0	4	2.601	discard	MATRIX_LR 0.04→0.06 (hypothesis: higher Muon LR = more learning per step in limited 1600 steps; evidence: LR never tuned): val_bpb 0.8987→0.9065 WORSE by 0.008 — training loss at peak phase was higher (3.17 vs ~3.0 at step 834) suggesting overshooting. MATRIX_LR 0.04 is near-optimal; increasing hurts convergence
cefc418	0.906164	9.6	87.8	57248	1555	229.0	4	2.692	discard	EMBEDDING_LR 0.4→0.8 (hypothesis: embeddings are 51% of params and may be undertrained at LR=0.4 with only 1600 steps; evidence: category switch after MATRIX_LR): val_bpb 0.8987→0.9062 WORSE by 0.007 — higher embedding LR degrades convergence; embeddings already well-tuned at 0.4. AdamW is sensitive to LR at this scale
eb38add	0.904781	11.1	95.6	46810	1291	291.1	4	2.596	discard	ASPECT_RATIO 48→56 width 768→896 7heads 291M params (hypothesis: wider model=more capacity per layer; evidence: Depth Delusion paper Jan2026 says wider>deeper): val_bpb 0.8987→0.9048 WORSE by 0.006 — 19% fewer tokens (169M vs 208M) outweighs capacity gain. At 60min budget tokens-per-second matters more than model width. Width 768 is optimal
9bb3894	0.936836	11.1	83.7	55000	1511	229.0	4	2.982	discard	aux multi-token prediction loss: predict token+2 with shared lm_head weight=0.1 (hypothesis: extra gradient signal improves data efficiency with only 208M tokens/229M params; evidence: DeepSeek-V3 MTP): val_bpb 0.8987→0.9368 CATASTROPHICALLY WORSE by 0.038 — shared lm_head gets conflicting gradients from next-token and next-next-token objectives. MTP needs SEPARATE prediction heads to avoid poisoning the main objective
59070d5	0.908052	9.4	91.3	58900	1622	229.0	4	2.837	discard	parallel attention+MLP blocks GPT-J/PaLM style (hypothesis: parallel blocks remove one norm+sequential dep per layer increasing throughput; evidence: PaLM uses this at scale): val_bpb 0.8987→0.9081 WORSE by 0.009 — 3.5% more tokens (212M vs 208M) but 0.2 higher training loss. Sequential attn→MLP dependency is critical — MLP needs to see attention output to refine representations
80abc63	0.905826	9.8	87.4	55500	1536	229.0	4	2.751	discard	SHORT_WINDOW 256→512 (hypothesis: S-layers starved of context at 256 tokens=12.5% of seq; evidence: throughput-neutral change to improve attention quality): val_bpb 0.8987→0.9058 WORSE by 0.007 — 3% fewer tokens (201M vs 208M) and MFU dropped 88.7→87.4. Wider window increases VRAM (9.6→9.8GB) and compute. The 256-token window is sufficient for local attention; wider window wastes compute. SSSL+256 is optimal
bdbf987	0.893220	10.0	84.1	53000	1473	229.0	4	2.658	keep	Peri-LN post-norm after sublayers: norm(sublayer(norm(x))) instead of sublayer(norm(x)) (hypothesis: post-norm stabilizes gradient flow at depth 16; evidence: Peri-LN paper arxiv 2502.02732): val_bpb 0.8987→0.8932 IMPROVED by 0.0055 — post-norm wrapping provides better activation statistics across 16 layers; 7% throughput cost (57k→53k tok/sec) more than compensated by quality gain
0ed8d04	0.917447	10.2	86.4	54000	1485	229.0	4	2.650	discard	remove logit softcap (hypothesis: softcap=15 redundant with QK-norm since max attn logit ≈11.3; evidence: nanochat#362 proposes same): val_bpb 0.8932→0.9174 WORSE by 0.024 — CRITICAL INSIGHT: softcap applies to LM HEAD logits not attention logits! It constrains output prediction confidence during training. QK-norm only bounds attention scores. Softcap is essential for training stability — the tanh limits overconfident word predictions
e288de4	0.892956	10.3	84.5	54000	1507	229.0	4	2.552	discard	MATRIX_LR 0.04→0.03 (hypothesis: Peri-LN better gradient flow allows lower LR for smoother convergence; evidence: 0.06 was too high on old arch): val_bpb 0.8932→0.8930 MARGINAL 0.0003 below 0.002 threshold — not reliably distinguishable from variance. More steps (1507 vs 1473) from slightly faster convergence but no meaningful quality gain. MATRIX_LR 0.04 remains optimal
46f13e8	0.000000	0.0	0.0	0	0	0.0	0	0.000	crash	label_smoothing=0.1 in cross_entropy (hypothesis: regularization helps undertrained model): KILLED EARLY — flawed experiment: (1) label_smoothing inflates eval loss in evaluate_bpb since forward() applies it to val data too, making val_bpb comparison unfair (2) MFU dropped 84→68% massive throughput regression from label_smoothing computation (3) would need to separate train/eval loss paths to test properly
e1d6487	0.000000	0.0	0.0	0	0	0.0	0	0.000	crash	GQA n_kv_head 6→3 + value_emb 768→384 (hypothesis: halving KV heads saves compute increases throughput; evidence: Llama/Mistral GQA): KILLED EARLY — MFU dropped 84→74% (GQA attention path slower on RTX 5070) AND loss trajectory worse (3.2 vs 3.08 at step 400). GQA not beneficial at this scale — the 29M param reduction (229→200M) hurts capacity more than throughput gained. Also reduces value_emb expressiveness
6be55fc	0.891116	10.5	86.5	56000	1554	229.0	4	2.650	keep	x0_lambdas init 0.1→0.2 (hypothesis: stronger value residual connection helps deeper layers access input embedding; evidence: value residual learning paper arxiv 2410.17897): val_bpb 0.8932→0.8911 IMPROVED by 0.0021 — stronger x0 init + higher throughput (56k vs 53k, 203M vs 193M tokens) both contributed. MFU recovered 84→86.5% (possibly recompilation benefit)
5d93e43	0.895749	10.6	90.8	56000	1538	229.0	4	2.789	discard	constant WD=0.1 (removed linear decay to 0; hypothesis: maintain regularization in warmdown improves generalization): val_bpb 0.8911→0.8957 WORSE by 0.0046 — constant WD actively fights convergence during warmdown phase; training loss 2.79 vs 2.65 baseline. Decaying WD to 0 is correct: regularization should ease off as model settles into minima
491b5e7	0.895683	10.0	85.3	55000	1534	229.0	4	2.740	discard	z-loss coeff=1e-4 on raw logits before softcap (hypothesis: smooth gradient penalty on large logits improves generalization; evidence: PaLM/ST-MoE): val_bpb 0.8911→0.8957 WORSE by 0.0046 — z-loss redundant with softcap=15 which already bounds logits; 1.5% MFU overhead (85.3 vs 86.5) reduces tokens trained; no quality benefit
447c655	0.892791	9.9	84.4	55000	1511	267.6	4	2.594	discard	second embedding table embed2 with per-layer x1_lambdas init 0.1 (hypothesis: multiple embeddings improve per-step learning; evidence: modded-nanogpt WR): val_bpb 0.8911→0.8928 WORSE by 0.0017 — 38.6M extra params (267M total) added throughput overhead (198M vs 203M tokens) that offset any per-step learning gain. Single embedding x0 with value_emb is sufficient at this budget
4cad1fd	0.886468	9.9	84.4	55000	1519	229.0	4	2.699	keep	token shift mixing before attention: replace last 1/4 channels with previous position features via torch.roll (hypothesis: direct bigram access improves per-step learning; evidence: modded-nanogpt Smear module): val_bpb 0.8911→0.8865 IMPROVED by 0.0046 — zero-parameter op gives each layer cheap local context; 2% throughput cost (199M vs 203M tokens) more than compensated by quality gain
4efe38c	0.882485	9.8	83.2	53000	1446	229.0	4	2.719	keep	partial RoPE 50% head dims (hypothesis: non-positional dims enable content-based attention; evidence: modded-nanogpt GPT-NeoX use partial RoPE): val_bpb 0.8865→0.8825 IMPROVED by 0.0040 — half-dim RoPE lets 64/128 dims attend position-free improving quality; slight MFU drop 86.5→83.2% from torch.compile interaction but net positive
606608d	0.886541	11.2	83.3	53000	1466	229.0	4	2.518	discard	WARMUP_RATIO 0.05→0.10 (hypothesis: longer warmup helps 16-layer Peri-LN model find better directions; evidence: never tuned): val_bpb 0.8825→0.8865 WORSE by 0.004 — slower ramp-up to peak LR wastes training time; 5% warmup (~72 steps) is sufficient for this model. Lower train loss (2.52 vs 2.72) suggests overfitting from longer warmup phase
5863979	0.883445	10.4	84.5	54000	1491	229.0	4	2.692	discard	optimize partial RoPE: torch.empty_like+slice instead of torch.cat (hypothesis: cat creates extra copies hurting MFU; evidence: MFU dropped 86.5→83.2 after partial RoPE): val_bpb 0.8825→0.8834 WORSE by 0.0009 — MFU recovered 83.2→84.5% and got 3% more tokens (195M vs 189M) but val_bpb slightly worse; torch.compile generates different kernels for empty_like vs cat affecting gradient flow
062bef2	0.887122	10.7	80.3	52500	1450	229.0	4	2.578	discard	ADAM_BETAS beta1 0.8→0.9 (hypothesis: standard beta1=0.9 provides more momentum for embeddings/lm_head 51% of params; evidence: 0.9 is universal default): val_bpb 0.8825→0.8871 WORSE by 0.0046 — higher momentum oversmoothes embedding gradients; MFU dropped 83→80% (torch.compile interaction). beta1=0.8 is correct for this setup: embeddings need faster adaptation with only ~1500 steps
b4e8330	0.895800	10.3	80.9	50800	1402	229.1	4	2.739	discard	soft head gating MoH-inspired sigmoid(Linear(x)) per-head per-token gate on attn output (hypothesis: per-token head selection improves specialization; evidence: MoH ICML2025 arxiv 2410.11842): val_bpb 0.8825→0.8958 WORSE by 0.013 — sigmoid(0)=0.5 init halves attention contribution disrupting attn/MLP balance; MFU dropped 83→81% and 3% fewer tokens (184M vs 189M). Head gating not beneficial at 6-head scale
257d32e	0.900251	9.8	83.5	52500	1458	229.0	4	2.600	discard	U-net skip connections layer 0→15 1→14 etc (hypothesis: early features help late layers via reverse skip; evidence: modded-nanogpt uses U-net skips): val_bpb 0.8825→0.9003 WORSE by 0.018 — unscaled skip additions disrupt learned residual stream; early features too raw for late layers. Good throughput (191M tokens 83.5% MFU) but quality degraded. Would need learnable mixing weights or careful scaling
ce1614f	0.884308	9.7	83.1	54900	1498	229.0	4	2.617	discard	UNEMBEDDING_LR 0.004→0.01 (hypothesis: lm_head undertrained at 100x lower LR than embeddings; evidence: never tuned): val_bpb 0.8825→0.8843 WORSE by 0.0018 marginal/noise — lm_head not the bottleneck; higher LR didn't improve despite 4% more tokens (196M vs 189M). 0.004 is well-calibrated
9cc425b	0.883568	10.3	84.0	54900	1495	229.0	4	2.637	discard	SOFTCAP 15→12 tighter output logit constraint (hypothesis: stronger implicit regularization in data-limited regime; evidence: softcap 30 caused instability so tighter should help): val_bpb 0.8825→0.8836 WORSE by 0.001 noise-level — tighter cap didn't help despite 4% more tokens (196M vs 189M). Softcap 15 well-calibrated; neither looser (30→crash) nor tighter (12→noise) improves
cf55936	0.885297	10.5	79.8	54400	1437	229.0	4	2.586	discard	inner MLP norm between SwiGLU hidden and projection (hypothesis: norm inside MLP improves gradient flow like Peri-LN; evidence: NormFormer arxiv 2110.09456): val_bpb 0.8825→0.8853 WORSE by 0.003 — MFU dropped 83.2→79.8% from norm overhead AND quality degraded. RMS norm removes scale information that SwiGLU gating relies on. Over-norming: input_norm→gate*up→hidden_norm→proj→output_norm is 3 sequential norms which constrains expressiveness
a52db85	0.884487	9.9	82.5	52800	1442	229.0	4	2.580	discard	resid_lambdas init 1.0→1.05 (hypothesis: stronger skip connections improve gradient flow in 16-layer model; evidence: modded-nanogpt uses 1.1^0.5≈1.048): val_bpb 0.8825→0.8845 WORSE by 0.002 at noise threshold — amplified residual didn't improve quality; model may already have optimal residual scaling from Peri-LN double-norm. Skip connection strength not the bottleneck
d4c94e0	0.891203	10.0	81.9	53000	1477	229.1	4	2.717	discard	gated attention per-head sigmoid gate Y'=Y*σ(XW) init bias=4.0 (hypothesis: input-dependent head sparsity breaks plateau; evidence: Qwen NeurIPS 2025 best paper <2% overhead): val_bpb 0.8825→0.8912 WORSE by 0.009 — despite proper init (sigmoid(4)≈0.98 near pass-through) quality degraded. 2% MFU drop (83.2→81.9) means fewer tokens (194M vs 189M) AND gate computation adds noise to gradient flow through attention. At 6 heads per-head gating too coarse; paper validated at larger scales (1.7B+). Both MoH and gated attention fail at this scale — head gating needs more heads to be beneficial
f0a0b04	0.890627	10.2	81.6	50700	1394	229.1	4	2.506	discard	causal depthwise conv1d kernel=3 replacing token shift identity init (hypothesis: learnable local mixing richer than fixed shift; evidence: hybrid conv-attn architectures): val_bpb 0.8825→0.8906 WORSE by 0.008 — MFU dropped 83.2→81.6% yielding 6% fewer tokens (183M vs 189M); conv adds overhead without sufficient quality gain to compensate. 3D conv weights handled by AdamW not Muon (further hurting optimization). Simple token shift is more efficient at this scale
c887479	0.000000	0.0	0.0	0	0	0.0	0	0.000	crash	torch.compile mode=reduce-overhead CUDA graphs (hypothesis: less Python overhead improves MFU): CRASH — CUDA graphs incompatible with flex_attention block mask caching (tensor output overwritten by subsequent run). reduce-overhead mode cannot work with dynamic mask tensors in flex_attention
509e05b	0.901528	9.9	78.9	51300	1372	229.0	4	2.642	discard	housglass MLP K=2 stacked SwiGLU sub-MLPs hidden 2048→2×1024 same params (hypothesis: deeper nonlinear composition per FLOP; evidence: Feb 2026 arxiv 2602.06471 at 113-403M): val_bpb 0.8825→0.9015 WORSE by 0.019 — MFU dropped 83.2→78.9% from smaller matmuls (768×1024 less efficient than 768×2048 on RTX 5070 tensor cores); 5% fewer tokens (180M vs 189M); the sequential SwiGLU path adds latency per layer. Deeper MLP composition does NOT overcome throughput loss at this scale. Single wide MLP is more hardware-efficient
5a0abd5	0.890576	10.0	79.5	44216	1386	229.0	4	2.459	discard	RoPE base 10000→1024 (hypothesis: concentrate rotary frequencies within 2048 context range; evidence: modded-nanogpt uses base=1024): val_bpb 0.8825→0.8906 WORSE by 0.008 — MFU dropped 83→79.5% and 4% fewer tokens (182M vs 189M). Base=1024 compresses frequencies too much for our 229M/16-layer/Peri-LN architecture; optimal base is architecture-dependent not universal
cc33d56	0.883038	10.7	85.6	53074	1469	229.0	4	2.623	discard	SHORT_WINDOW 256→128 (hypothesis: halve S-layer attention cost for more throughput; evidence: modded-nanogpt uses 128): val_bpb 0.8825→0.8830 noise-level 0.0006 — throughput improved (85.6 vs 83.2% MFU 192.5M vs 189M tokens) but quality per step slightly worse offsetting gain. 128 too narrow for S-layers at 229M/16-layer scale
fb920ad	0.883616	10.6	84.8	54414	1482	229.0	4	2.636	discard	per-sublayer learnable attn_scales/mlp_scales init=1.0 (hypothesis: learnable attn/MLP balance improves deep feature learning; evidence: modded-nanogpt per-sublayer scaling): val_bpb 0.8825→0.8836 noise-level 0.001 — throughput improved (84.8 vs 83.2% MFU 194M vs 189M tokens) but quality-per-step unchanged. Peri-LN double-norm already provides sufficient sublayer scaling; extra learnable scales are redundant
99c3ef0	0.000000	0.0	0.0	0	0	0.0	0	0.000	crash	layer-scaled MLP widths by depth hidden_dims 1568→2528 around 2048 average (hypothesis: later layers need more FFN capacity at fixed parameter budget, evidence: OpenELM-style layer-wise scaling + plateau after 5 non-crash runs): crashed before first step with "input must be contiguous"; forcing contiguous activations at attention/MLP boundaries did NOT fix it. Rules out this heterogeneous per-layer MLP-width design on the current torch.compile+MXFP8+checkpointing stack
e0d4921	0.000000	0.0	0.0	0	0	0.0	0	0.000	crash	HEAD_DIM 128→192 (6 heads→4 at fixed 768 width; hypothesis: larger per-head capacity improves attention expressivity, evidence: HEAD_DIM 64 was worse despite more tokens): crashed at compile with Triton resource error "No valid triton configs" / fused rms_norm+flex_attention out of resource. Rules out 192-dim heads on this Blackwell+torch.compile stack without deeper kernel/workload changes
4e755d4	0.909420	10.1	75.6	47000	1305	229.1	4	2.638	discard	TRANSPONDER input-adaptive residual gates: per-token sigmoid(Linear(x)) gate on attn+MLP sublayer outputs init bias=3.0 (hypothesis: dynamic content-aware gating breaks plateau; evidence: TRANSPONDER paper 5-15% perplexity reduction at 60-250M scale): val_bpb 0.8825→0.9094 WORSE by 0.027 — MFU dropped 83.2→75.6% yielding 10% fewer tokens (171M vs 189M); gate computation adds significant overhead per layer. Quality per step also degraded — sigmoid gating disrupts the Peri-LN gradient flow pattern. Input-adaptive gating NOT beneficial at this architecture/scale combination
6f075af	0.887527	10.0	82.4	52000	1482	229.0	4	2.676	discard	stochastic depth linear 0→0.1 drop prob across layers compile-friendly tensor mask (hypothesis: regularization helps in undertrained regime per arXiv 2303.01500; evidence: LayerDrop ICLR 2020): val_bpb 0.8825→0.8875 WORSE by 0.005 — random block zeroing disrupts the Peri-LN gradient flow pattern; 82.4% MFU vs 83.2% baseline slight throughput cost; more tokens (194M vs 189M) but quality per step degraded. Stochastic depth not beneficial with Peri-LN double-norm architecture
