commit	val_bpb	memory_gb	mfu	tok_per_sec	num_steps	num_params_M	batch_size	final_loss	status	description
78bb4b3	0.000000	0.0	0.0	0	0	0.0	0	0.000	crash	Hybrid Conv-Attention: 12/16 S-layers replaced with ConvGate (depthwise conv1d k=4 + SiLU + sigmoid gate; Nemotron Mamba-hybrid inspired; hypothesis: cheaper local mixing = more tokens): CRASHED — (1) Conv1d 3D weights incompatible with Muon optimizer grouping, (2) total params dropped to 193M below 200M minimum. Conv layers too lightweight (only ~1.2M vs 1.77M per attention layer). Also: batch=4 gave RuntimeError tensor size mismatch during compilation. Fundamental issue: replacing attention with simple conv loses too much capacity AND creates optimizer compatibility problems
8410ed7	0.899961	11.8	71.1	48700	1330	200.3	4	2.735	discard	HEAD_DIM 128→96: 8 Q-heads/4 KV-heads (Nemotron 'more specialists same cost' applied to attention; hypothesis: more diverse attention patterns improve quality): val_bpb 0.8717→0.8999 WORSE by 0.028 — head_dim 96 is suboptimal for MXFP8 tensor cores causing MFU drop 82→71% and throughput drop 194M→174M tokens (11% fewer). The per-step quality also degraded (final loss 2.74 vs 2.63 baseline). Smaller heads mean less expressive attention per pattern AND fewer rotary dims (48 vs 64 for partial RoPE) reducing positional resolution. At 768 dim 6 heads with 128 head_dim is the sweet spot for both tensor core efficiency and attention quality
f0d7882	0.000000	0.0	0.0	0	0	0.0	0	0.000	crash	MXFP4 cutlass training replacing MXFP8 cublas (Nemotron NVFP4-inspired; hypothesis: 4-bit matmuls give ~2x throughput on Blackwell; evidence: Nemotron 3 Super uses NVFP4 natively): CRASHED — torchao mxfp4_cutlass has scale size mismatch bug with torch.compile: 'scale_a must have 98304 got 196608'. MXFP4 block_size=16 (half of MXFP8's 32) creates 2x more scales than torch.compile expects. Library-level incompatibility between MXFP4 cutlass and torch.compile on consumer Blackwell. MXFP4 training not ready in torchao for this hardware
98e11c6	0.885017	11.3	76.1	52300	1448	200.3	4	2.565	discard	ReLU² activation replacing SiLU in SwiGLU gate (hypothesis: exact sparsity + stronger gradients improve feature selection per MLP step; evidence: modded-nanogpt WR uses ReLU²): val_bpb 0.8717→0.8850 WORSE by 0.013 — ReLU² dropped MFU 82→76% (causing 189M vs 194M tokens = 3% fewer) AND degraded quality per step. Final loss 2.57 vs 2.63 baseline looks better but val_bpb is worse indicating overfitting: ReLU² sharp gating (exact zeros) creates less smooth optimization landscape. SiLU's smooth non-zero gradients for all inputs are better suited for short 60min training — the model doesn't have enough steps to properly learn the hard-sparse feature selection ReLU² demands. At this training scale SiLU's exploration-friendly gradients beat ReLU²'s sparsity
331b251	0.884232	11.3	75.7	50600	1400	200.3	4	2.587	discard	SHORT_WINDOW 256→512: wider local attention for S-layers (hypothesis: double context in 12/16 layers improves local dependency modeling; evidence: modded-nanogpt uses 128-384 range): val_bpb 0.8717→0.8842 WORSE by 0.013 — wider windows dropped throughput 194M→184M tokens (5% fewer steps) AND degraded quality per step. Final loss 2.59 vs 2.63 baseline looks slightly better but val_bpb is worse indicating the extra attention compute per layer doesn't improve generalization. At window=512 each S-layer attends to 25% of seq_len=2048 which creates redundancy with L-layers (full attention). The SSSL pattern design assumes S-layers handle LOCAL context (256 tokens = ~1-2 paragraphs) while L-layers handle GLOBAL; window=512 blurs this distinction. SHORT_WINDOW=256 is optimal for the current SSSL architecture
4af2da4	0.907282	11.9	65.1	41900	1159	200.3	4	2.787	discard	WINDOW_PATTERN SSSL→SSLL: 50% long attention layers (hypothesis: more global context improves quality; evidence: nanochat uses more L-layers): val_bpb 0.8717→0.9073 CATASTROPHICALLY WORSE by 0.036 — doubling L-layers dropped throughput 194M→152M tokens (22% fewer) with MFU 82→65%. VRAM spiked 10.2→12.2GB near limit. The compute cost of full attention (O(T²) for T=2048) is far higher than estimated. Each L-layer costs ~8x more attention compute than S(256). The SSSL pattern is optimal because it allocates expensive global attention sparingly (every 4th layer) while using cheap local attention for most layers. Quality per token didn't improve enough to offset massive throughput loss. Rules out any pattern with more L-layers
4bc30f8	0.908411	11.3	76.5	52700	1450	200.3	4	2.719	discard	Remove softcap (logit capping=15→uncapped; hypothesis: QK-norm alone is sufficient for stability; evidence: Gemma 3 removed softcap with QK-norm): val_bpb 0.8717→0.9084 CATASTROPHICALLY WORSE by 0.037 — without softcap the model overfits to train data (final loss 2.72 slightly worse AND val_bpb much worse = generalization collapse). Softcap at 15 acts as implicit regularization on the output distribution preventing the model from becoming overconfident. MFU also dropped 82→76.5% (recompilation artifact). Throughput similar (190M vs 194M tokens). Softcap is ESSENTIAL for generalization at this training scale — it prevents the lm_head from dominating gradients with extreme logit values. Rules out any softcap removal/increase
df14b02	0.000000	0.0	0.0	0	0	0.0	0	0.000	crash	softcap 15→30 wider logit range (Gemma 2 default; hypothesis: 15 too restrictive for 50K vocab; evidence: Gemma 2 uses 30): KILLED by user — experiment stopped early. Previous experiments showed softcap removal (uncapped) was catastrophic (val_bpb +0.037), so doubling softcap likely unhelpful. Session ending
5e06ccd	0.881784	10.7	79.7	57000	1577	200.3	4	2.661	discard	WINDOW_PATTERN SSSL→SSSSSSSL halve L-layers 4→2 (hypothesis: fewer expensive L-layers = more throughput; evidence: SSLL catastrophic so opposite should help): val_bpb 0.8717→0.8818 WORSE by 0.010 — INVALID COMPARISON: ran with n_kv_head=3 (GQA bug from exp#92 leftover) at 200M params instead of 229M. Throughput improved 6.5% (206M vs 194M tokens 57k vs 54k tok/sec) but 14 S-layers with only 2 L-layers insufficient global context. Also discovered n_kv_head bug: build_model_config had num_heads//2 leftover from GQA experiment
40449f0	2.668253	10.8	78.4	54000	1404	229.1	4	5.367	discard	fix n_kv_head GQA bug (3→6) + per-channel LayerScale init=0.1 CaiT-style (hypothesis: per-channel sublayer scaling gives finer control than scalar; evidence: CaiT arxiv 2103.17239): val_bpb 0.8717→2.668 CATASTROPHICALLY WORSE — LayerScale init=0.1 with Peri-LN kills gradient flow. Peri-LN already normalizes sublayer outputs to unit variance; 0.1x further reduction makes layers barely contribute. Loss stuck at 5.2-5.3 vs normal 2.6. LayerScale conflicts with post-norm architectures. n_kv_head fix confirmed working (229M params restored)
c9b49fc	0.875800	10.6	82.7	54000	1493	229.0	4	2.647	discard	fix n_kv_head GQA bug (3→6) + token shift 1/4→1/3 channels (hypothesis: more shifted channels = more local context per layer; evidence: token shift 1/4 was +0.0046 so 1/3 might be better): val_bpb 0.8717→0.8758 WORSE by 0.004 — n_kv_head fix confirmed working (229M params 82.7% MFU 196M tokens matches baseline). But shifting 1/3 (256 channels) too aggressive; replacing 33% of current position info with prev position degrades quality vs 25%. The 75% current + 25% prev split is optimal; more prev position info dilutes the unique signal
61aa8a7	0.872582	11.0	81.5	54000	1470	229.0	4	2.671	discard	multi-scale S-layer windows 128/256/384 cycling avg=256 (hypothesis: attention diversity from multi-scale windows improves feature learning; evidence: modded-nanogpt uses progressive windows): val_bpb 0.8717→0.8726 noise-level 0.0009 — VRAM spiked 10.1→11.0GB from 384-window layers (O(T*W) VRAM scales with window). Throughput slightly lower (192.7M vs 194M tokens 81.5 vs 82.3% MFU). The 384-window overhead outweighs 128-window savings. Uniform 256 is optimal for compute and VRAM balance
c134857	0.000000	0.0	0.0	0	0	0.0	0	0.000	crash	DyT (Dynamic Tanh) replacing Peri-LN post-norm alpha_init=1.0 gamma_init=1.0 (hypothesis: DyT replaces post-norm with learnable non-linear squashing; evidence: Meta AI CVPR 2025): KILLED — loss stuck at 5.42-5.44 at step 641 (baseline ~3.5 at same point). DyT tanh saturation at [-1 1] constrains sublayer output too much. Same failure mode as LayerScale: replacing or weakening post-norm breaks gradient flow in this 16-layer Peri-LN architecture. The RMSNorm post-norm is ESSENTIAL — it preserves signal scale while normalizing variance. Tanh squashing loses both. Conclusively rules out replacing post-norm with ANY amplitude-limiting function
5b6c6d1	0.872982	10.7	82.1	54000	1480	229.0	4	2.685	discard	n_kv_head bugfix validation: restore n_kv_head=num_heads=6 (was num_heads//2=3 since exp#92). val_bpb 0.8730 within noise of best 0.8717 (diff 0.0013 < σ≈0.002). Confirms 229M model restored correctly. All experiments 92-98 ran with broken 200M params. This run validates the fix. Keeping as new clean baseline with bugfix
93d74b2	0.872444	10.8	81.9	53700	1474	229.0	4	2.618	discard	AdamW beta2 0.95→0.98 for embedding/scalar params (hypothesis: higher beta2 reduces noise in adaptive LR estimates for embeddings; evidence: standard AdamW default is 0.999): val_bpb 0.8730→0.8724 noise-level diff 0.0006 — not a meaningful improvement. beta2=0.95 was already well-calibrated for this training scale. Higher beta2 makes second moment estimates more sluggish which slightly hurts fast adaptation during warmdown phase
ed4f06d	0.881784	10.9	79.8	52300	1441	229.0	4	2.573	discard	Parallel attention+MLP blocks PaLM-style (hypothesis: parallel blocks where attn and MLP share same input improve feature learning; evidence: PaLM GPT-J GPT-NeoX all use parallel blocks): val_bpb 0.8730→0.8818 WORSE by 0.009 — MLP operating on pre-attention input loses the sequential feature refinement where MLP processes attention-enriched representations. Also throughput dropped 194M→189M tokens (79.8 vs 82.1% MFU) from extra norm computation. At 200M scale sequential blocks are significantly better because each layer needs MLP to refine attention output. Parallel blocks work at larger scales (>1B) where redundancy is tolerable. Rules out parallel block architecture at this scale
d76167c	0.000000	0.0	0.0	0	0	0.0	0	0.000	crash	Window warmup S=128/L=512→S=256/L=2048 at 50% (hypothesis: smaller early windows = more steps; evidence: modded-nanogpt uses window warmup): CRASHED — silent exit during startup, likely dynamic window size broke torch.compile or autotune. Window attention already thoroughly explored in 7 prior experiments; SSSL S=256 L=2048 confirmed optimal
d76167c	0.000000	0.0	0.0	0	0	0.0	0	0.000	crash	Window warmup S=128/L=512→S=256/L=2048 at 50% (hypothesis: progressive window expansion for faster early steps; evidence: modded-nanogpt uses window warmup): ABORTED — window territory already thoroughly explored (7 prior window experiments all failed). Also silent crash on startup likely from flex_attention recompilation issues with dynamic window sizes
e34161c	0.000000	0.0	0.0	0	0	0.0	0	0.000	crash	Heterogeneous batching: AdamW params step every 2nd optimizer step (hypothesis: 2x effective batch for embed/head reduces gradient noise; evidence: modded-nanogpt technique): CRASHED — GPU segfault during torch.compile. Setting p.grad=None selectively for Muon params while keeping AdamW grads across steps creates an inconsistent gradient state that torch.compile cannot handle. The compiled graph expects uniform grad lifecycle across all params. Selective grad zeroing is incompatible with torch.compile on this hardware
126affc	0.879300	10.7	78.4	51500	1416	229.0	4	2.685	discard	skip gate: gated shortcut layer 4→12 zero-init (modded-nanogpt inspired; hypothesis: gated skip gives late layers direct access to early features; evidence: modded-nanogpt WR uses skip gate 3→6): val_bpb 0.8730→0.8793 WORSE by 0.006 — MFU dropped 82→78% yielding 5% fewer tokens (186M vs 194M); the gated skip broke torch.compile graph optimization adding ~4% latency per step. Quality per step also degraded — late layers already access early features via x0_lambdas value residual making an explicit skip redundant. Different from failed U-net exp#37 (unscaled ALL layers) but same conclusion: additional skip connections don't help in Peri-LN architecture with value residual
7bfb57e	0.881764	10.7	80.7	52500	1450	229.0	4	2.568	discard	asymmetric logit rescale alpha=2.0 before softcap (modded-nanogpt inspired; hypothesis: wider dynamic range within softcap improves predictions while detach trick preserves gradients; evidence: modded-nanogpt WR): val_bpb 0.8730→0.8818 WORSE by 0.009 — OVERFITTING: train loss 2.57 vs 2.69 baseline (lower) but val_bpb worse = model overconfident on training data. Rescaled logits let model express sharper predictions that memorize training patterns without improving generalization. MFU slightly lower 82→81% from detach operation. Softcap at 15 with default logit range is already optimal — widening the range increases expressiveness but hurts the implicit regularization that softcap provides. At 190M tokens for 229M params the model is severely undertrained; MORE regularization helps not less
22ec4de	0.877714	10.6	79.6	52400	1427	229.0	4	2.630	discard	SCALAR_LR 0.5→0.2 first-ever scalar LR tuning (hypothesis: x0_lambdas/resid_lambdas overshooting at LR=0.5 in ~1480 steps causes overfitting; evidence: asymmetric rescale showed train-val gap + SCALAR_LR never tuned): val_bpb 0.8730→0.8777 WORSE by 0.005 — MFU dropped 82→80% yielding 4% fewer tokens (187M vs 194M). Lower scalar LR under-trains x0_lambdas and resid_lambdas: value residual mixing (x0 init=0.2) needs fast adaptation to find optimal per-layer values in limited steps. SCALAR_LR 0.5 is correct — scalar params are so few (32 params) that higher LR enables efficient exploration. Slower LR leaves them near init values reducing their benefit
2786d4e	0.000000	0.0	0.0	0	0	190.4	0	0.000	crash	embedding tying wte=lm_head (hypothesis: shared input/output embedding improves generalization in undertrained regime; evidence: GPT-2/BERT/T5 all tie): KILLED — loss stuck at 10.825 for 150+ steps (uniform prediction). wte init std=1.0 causes lm_head logits to saturate softcap=15 at init (self-prediction logit=768 → capped to 15). All 50K logits cluster near ±15 creating degenerate softmax where gradients vanish. The dual gradient (input sparse + output dense) at EMBED_LR=0.2 cannot escape this basin. Standard models that tie use much lower LR (1e-4) and no softcap. Tying requires fundamentally different init/LR/softcap calibration incompatible with current Muon+Peri-LN architecture. Rules out embedding tying without major rearchitecting
99e4dc3	0.000000	0.0	0.0	0	0	229.0	0	0.000	crash	MLP-first sublayer ordering MLP→Attention instead of Attention→MLP (hypothesis: MLP pre-processes features before cross-position mixing): KILLED — MFU 13% (6x slower than normal 82%), loss stuck at 10.825 (uniform prediction) after 8 steps. MLP-first breaks torch.compile optimization producing pathological kernel code. Same failure mode as parallel blocks but worse because reversed ordering disrupts the compile graph entirely. Sequential Attention→MLP confirmed essential
55a4659	0.000000	0.0	0.0	0	0	229.1	0	0.000	crash	Pad vocab 50257→50272 for lm_head MXFP8 compatibility (hypothesis: lm_head is 25% of compute but excluded from MXFP8 because 50257%32\!=0; evidence: MXFP8 filter requires both dims div by 32): CRASHED — 'input must be contiguous' from MXFP8 cublas kernel on lm_head(768→50272). The MXFP8 cublas implementation cannot handle vocab-sized output matrices even with 32-aligned dims. Contiguity requirement is an MXFP8 cublas kernel limitation not a dimension alignment issue. Rules out MXFP8 quantization of the lm_head output layer
986ab5b	0.884322	10.4	79.5	59400	1609	210.0	4	2.781	discard	Factored lm_head 768→384→50257 bottleneck output projection (hypothesis: reduce lm_head FLOPs 50% for more tokens; evidence: lm_head is 23% of compute but not MXFP8): val_bpb 0.8730→0.8843 WORSE by 0.011 — throughput improved 8.7% (210.9M vs 194M tokens 59.4k vs 54k tok/sec) but per-step quality degraded significantly. 384-dim bottleneck limits output rank too much; the model cannot distinguish enough token directions through the narrow projection. Final loss 2.78 vs 2.63 baseline shows underfitting at output layer. Despite 1609 vs 1483 steps the quality-per-step degradation outweighs the throughput gain. Full-rank lm_head(768→50257) is essential for output expressiveness
6513836	0.877269	10.5	81.3	53800	1461	229.0	4	2.524	discard	x0_lambdas init 0.2→0.3 stronger value residual (hypothesis: 0.1→0.2 improved +0.0021 so 0.3 might continue trend; evidence: x0_lambdas 0.3 never tested): val_bpb 0.8730→0.8773 WORSE by 0.004 — stronger x0 connection oversaturates early feature mixing. At 0.3 init the effective x0 contribution (0.3×gate≈0.45) dominates the residual stream too much in early training causing the model to rely too heavily on raw embeddings rather than learning layer-specific features. The 0.1→0.2 improvement was at the sweet spot; 0.3 pushes past it. Throughput identical (191.5M vs 194M tokens 81.3 vs 82.3% MFU). x0_lambdas 0.2 confirmed optimal
a4c6d8d	0.876086	10.9	80.1	52573	1444	229.0	4	2.667	discard	Dual-stream EMA residual Hyper-Connections inspired [idea:e7a1f2] (hypothesis: secondary EMA stream provides richer gradient highways across 16 layers; evidence: DeepSeek HC paper arxiv 2409.19606 ICLR 2025): val_bpb 0.8730→0.8761 WORSE by 0.003 — MFU dropped 82→80% yielding 3% fewer tokens (189M vs 194M). The EMA stream (0.85 decay) adds loop-carried dependency that disrupts torch.compile graph optimization. Also the secondary stream initialized from x0 is too similar to the existing x0_lambdas value residual: both provide historical context to each block. With hc_alpha init=0 + SCALAR_LR=0.5 the model barely learns to use the stream in 1444 steps. Hyper-Connections need longer training or non-zero alpha init to show benefit. Rules out simple EMA-based secondary streams
8034550	0.000000	0.0	0.0	0	0	229.0	0	0.000	crash	GEGLU activation F.gelu replacing F.silu in gated MLP [idea:c9d0e1] (hypothesis: GeLU smoother activation improves gradient flow; evidence: never tested GEGLU specifically): KILLED — prior session ended at step 603/~1480. Loss ~3.0 comparable to baseline trajectory. Cannot evaluate val_bpb. GEGLU is same activation family as SiLU (both smooth ReLU approximations); ReLU² already failed twice confirming SiLU is optimal for this architecture
328c861	0.888770	10.5	83.2	53500	1458	229.0	4	2.582	discard	Nesterov momentum for Muon: g=grad+μ*buffer instead of g=(1-μ)*grad+μ*buffer [idea:a2b3c4] (hypothesis: Nesterov look-ahead improves convergence in 1480-step budget; evidence: Nesterov 1983 + exp#59 changed value not algorithm): val_bpb 0.8717→0.8888 WORSE by 0.017 — Nesterov puts 10x more weight on current gradient (g:v=1.05:0.90 vs 0.10:0.90) which amplifies MXFP8 quantization noise. The buffer-dominated dampened momentum is BETTER for this setup: NS orthogonalization provides directional correction already; extra gradient reactivity just adds noise. Rules out Nesterov-style look-ahead with Muon+MXFP8
3631ad7	0.000000	0.0	0.0	0	0	229.0	0	0.000	crash	Parametric QK-norm: learnable per-dim gain on Q,K after RMSNorm init=1.0 [idea:fd01c8] (hypothesis: per-dim gain allows selective feature emphasis after QK-norm; evidence: exp#77 was scalar init=0.2 this is per-dim init=1.0): KILLED at step 485 — MFU dropped 82→74% from torch.compile interaction with per-layer gains passed as GPT-level params. Loss 4.31 at step 485 (baseline ~3.0) gap widening. The external parameter dependency breaks compile graph optimization: each layer gets unique gain tensors from GPT.forward disrupting kernel fusion. Rules out per-layer QK-norm parameters as GPT-level state
379c168	0.868475	10.5	85.8	54000	1485	229.0	4	2.610	keep	Key offset (k-shift): shift K non-RoPE dims by 1 pos via torch.roll for induction [idea:d7ea26] (hypothesis: shifting K stationary dims enables 1-layer induction heads where Q matches content and K provides previous-position features; evidence: modded-nanogpt WR uses key offset for stationary head dims): val_bpb 0.8717→0.8685 IMPROVED by 0.0032 — MFU also improved 82.3→85.8% yielding 4% more throughput (194.6M vs 194M tokens). Zero-parameter change. The k-shift enables cheap induction patterns complementary to token shift (which affects input not keys). Breaks 20+ experiment plateau!
36cba23	0.867647	10.5	85.8	54000	1485	229.0	4	2.608	discard	Muon momentum cooldown 0.95→0.85 during warmdown [idea:661b9f] (hypothesis: lower momentum during warmdown enables finer convergence with reduced update inertia; evidence: modded-nanogpt 0.85→0.95→0.85 schedule + exp#59 showed higher momentum worse): val_bpb 0.8685→0.8676 MARGINAL 0.0008 below 0.003 threshold — momentum cooldown provides negligible benefit. The existing cosine LR decay already handles convergence; reducing momentum simultaneously over-dampens updates. Throughput identical (194.6M tokens 85.8% MFU). Fixed momentum 0.95 is sufficient during warmdown
f1a24c6	0.864522	10.6	82.9	53400	1480	229.0	4	2.679	keep	MLP c_proj 2x LR multiplier [idea:a20a8e] (hypothesis: MLP output projection benefits from faster learning to map hidden features to residual directions; evidence: modded-nanogpt WR uses c_proj 2x LR): val_bpb 0.8685→0.8645 IMPROVED by 0.0040 — MFU dropped 85.8→82.9% from extra optimizer group but per-step quality improvement (2.68 vs 2.61 final loss yet better val_bpb) indicates better generalization. 16 c_proj weights learn 2x faster to write useful features to residual stream
