commit	val_bpb	memory_gb	mfu	tok_per_sec	num_steps	num_params_M	batch_size	final_loss	status	description
5c01dbc	0.866665	10.5	83.3	54500	1501	229.0	4	2.567	discard	Remove token shift simplification [idea:637287] (hypothesis: key offset subsumes token shift so removing it recovers throughput; evidence: both provide local context): val_bpb 0.8645→0.8667 WORSE by 0.002 — throughput improved (196.7M vs 194M tokens 83.3 vs 82.9% MFU) but quality per step degraded. Token shift and key offset are COMPLEMENTARY not redundant: token shift mixes prev-position features into Q and V (global local context) while key offset only shifts K (enabling induction patterns). Both are needed
3b76cf1	0.870833	10.4	80.8	52735	1454	229.0	4	2.587	discard	Blockwise LR per-layer ramp 0.5x-1.5x across 16 layers [idea:f6a7b8] (hypothesis: deeper layers have flatter loss landscape needing higher LR per sharpness disparity principle; evidence: ICML 2025 arxiv 2502.19002 ~2x speedup with AdamW): val_bpb 0.8645->0.8708 WORSE by 0.006 -- MFU dropped 82.9->80.8% from more optimizer groups (one per layer per shape) yielding 2% fewer tokens (190.6M vs 194M). The 0.5x LR on early layers likely undertrained them. Muon NS orthogonalization already normalizes gradient directions across layers making sharpness-based LR scaling redundant. The paper validated on AdamW which lacks this normalization. Rules out per-layer LR scaling with Muon optimizer
a15828e	0.881778	10.6	82.2	52811	1483	229.0	4	2.648	discard	Value embedding weight decay 0.0->0.1 [idea:a9d59b] (hypothesis: regularizing VE table improves generalization in undertrained regime; evidence: nanochat autoresearch found VE likes regularization): val_bpb 0.8645->0.8818 WORSE by 0.017 -- WD=0.1 too aggressive for sparse embedding table. L2 penalty pulls ALL 50257 token vectors toward zero every step (including rarely-used tokens) reducing VE expressiveness. The gated VE mechanism needs distinct embedding magnitudes to modulate per-head contribution. Same throughput (194M tokens 82.2% MFU). Nanochat may use much weaker regularization or different form (dropout not WD). Rules out strong WD on value embeddings
41f4b5f	0.870691	11.2	81.3	52400	1441	229.0	4	2.562	discard	Attention Q scale per-head init=1.0 after QK-norm [idea:9e5d64] (hypothesis: learnable per-head attention sharpness lets each head optimize its temperature; evidence: nanochat autoresearch found QKnorm scaler helps): val_bpb 0.8645->0.8707 WORSE by 0.006 -- VRAM spiked 10.5->11.4GB and throughput dropped (188.9M vs 194M tokens 81.3 vs 82.9% MFU). The q_scale multiplication after QK-norm creates larger intermediate tensors and disrupts torch.compile kernel fusion. Per-step quality also degraded: our Peri-LN + QK-norm already provides well-calibrated attention; extra learnable scale is redundant. 3 attention scale experiments now all failed (exp#77 init=0.2 exp#121 per-dim exp#128 per-head init=1.0). Rules out learnable QK-norm scaling at this architecture
52e88b9	0.863162	10.0	84.3	57581	1582	222.0	4	2.559	keep	MLP-only blocks for S-layers 12/13/14: skip attention for throughput (hypothesis: last 3 S-layers can be MLP-only since token shift+key offset provide local context; evidence: arxiv 2603.23198 MLP-only top layers at same param scale): val_bpb 0.8645->0.8632 IMPROVED by 0.0014 -- marginal improvement BUT 7% throughput gain (207M vs 194M tokens 84.3 vs 82.9% MFU 1582 vs 1480 steps) with 3% fewer params (222M vs 229M). VRAM decreased 10.5->10.0GB. The throughput gain is consistent and reliable. Per simplicity criterion: removing attention code is simpler so keep even at noise-level quality
7cc90bc	0.864924	10.1	83.1	55933	1544	222.0	4	2.683	discard	EMBEDDING_LR 0.4->0.3 + UNEMBEDDING_LR 0.004->0.008 [idea:a3a31d] (hypothesis: nanochat tuned defaults improve embedding optimization; evidence: nanochat autoresearch tuned across 700+ edits): val_bpb 0.8632->0.8649 WORSE by 0.0017 noise-level -- lower embed LR slightly undertrained embeddings (51% of params); higher unembed LR slightly overshot lm_head. Throughput slightly lower (202.4M vs 207M tokens 83.1 vs 84.3% MFU). Nanochat uses different architecture (no Peri-LN no MLP-only layers) so its tuned values dont transfer. EMBEDDING_LR 0.4 and UNEMBEDDING_LR 0.004 remain optimal for our setup
fb9eb1d	0.866117	10.0	84.7	57434	1579	219.6	4	2.634	discard	More MLP-only layers {10,12,13,14} extending from {12,13,14} [idea:9c1a5a] (hypothesis: layer 10 S-attention redundant after 10 layers of attention; evidence: MLP-only {12,13,14} improved throughput 7%): val_bpb 0.8632->0.8661 WORSE by 0.003 -- same throughput (207M tokens 84.7% MFU) but per-step quality degraded. Layer 10 attention IS needed: it sits right before L-layer 11 which provides global context. Without layer 10 attention the model loses local feature refinement before global mixing. 3 MLP-only layers {12,13,14} is the sweet spot; extending to 4 hurts. The diminishing returns hit: layers 12-14 after L-layer 11 were redundant but layer 10 before L-layer 11 is essential
9911b4c	0.866490	10.2	83.4	54722	1503	229.0	4	2.537	discard	Wider MLP in MLP-only layers {12,13,14}: hidden 2048→3072 +7M params to 229M [idea:810b28] (hypothesis: reinvest VRAM freed by removing attention into wider MLP capacity; evidence: ShishuLM arxiv 2510.13860 + MLP-only layers improved throughput 7%): val_bpb 0.8632→0.8665 WORSE by 0.003 — throughput dropped 5% (197M vs 207M tokens 1503 vs 1582 steps 83.4 vs 84.3% MFU) and per-step quality unchanged. Wider MLP adds capacity but the 50% larger matmuls (768×3072 vs 768×2048) slow each step enough to offset any quality-per-step gain. The original 2048 hidden is already well-sized for 768-dim model; 3072 is over-parameterized for these MLP-only layers. Optimal MLP width for throughput-quality tradeoff at 60min budget is 8/3x model_dim
34d8a29	0.860934	10.5	83.0	54167	1541	222.0	4	2.607	keep	Token shift for MLP-only layers {12,13,14}: mix last 1/4 channels with prev position before MLP [idea:0d0a8e] (hypothesis: MLP-only layers have zero cross-position context since no attention; token shift provides cheap local mixing; evidence: exp#73 tested MLP shift on ALL layers where it was redundant with attention; MLP-only layers are architecturally different): val_bpb 0.8632→0.8609 IMPROVED by 0.0023 — throughput dropped 2.5% (202M vs 207M tokens 83.0 vs 84.3% MFU) from 3 extra torch.roll+cat ops but per-step quality improved more than enough to compensate. Confirms MLP-only layers benefit from explicit local context that regular blocks get via attention. The residual from earlier attention layers provides GLOBAL context but not CURRENT-LAYER local mixing
5927907	0.868850	9.8	76.6	55500	1523	212.5	4	2.598	discard	Shared MLP weights across MLP-only layers {12,13,14}: one MLP applied 3x recurrent depth [idea:3ca6ad] (hypothesis: weight sharing creates recurrent depth improving param efficiency; evidence: RingFormer arxiv 2402.00976 matches full transformers with 20% params): val_bpb 0.8609->0.8689 WORSE by 0.008 -- MFU dropped 83->77% from torch.compile generating worse kernels when same module called 3x. Quality per step also degraded: shared MLP cant specialize per depth level. 9.4M fewer params (212.5M vs 222M) but throughput AND quality both worse. Recurrent depth not beneficial for MLP-only layers at this scale
ff0e3a1	0.867466	9.5	87.2	55800	1552	222.0	4	2.601	discard	Alternating value embeddings: VE on even attention layers + last layer only [idea:9aca50] (hypothesis: VE every layer is redundant; alternating creates diversity; evidence: nanochat uses alternating VE): val_bpb 0.8609->0.8675 WORSE by 0.007 -- MFU improved 83->87.2% (6% more throughput 203M vs 202M tokens) and VRAM dropped 10.5->9.5GB but per-step quality degraded significantly. VE on every attention layer IS essential: halving VE reduces the per-token learning signal from value embeddings. The gated VE mechanism needs to be active at every layer to provide consistent content-aware value modulation. Nanochat uses different architecture (no Peri-LN no MLP-only) so alternating VE doesnt transfer
66b649d	0.871592	9.7	82.7	55400	1543	222.0	4	2.692	discard	Sqrt warmdown shape replacing cosine: math.sqrt(cooldown) [idea:8c331e] (hypothesis: sqrt keeps LR higher longer for more learning in undertrained regime; evidence: arxiv 2508.01483 bias-variance tradeoff): val_bpb 0.8609->0.8716 WORSE by 0.011 -- sqrt kept LR at 0.47 even at 88% progress (cosine would be 0.13) preventing convergence. Final train loss 2.69 vs 2.61 baseline confirms insufficient low-LR fine-tuning. Throughput identical (202M tokens 82.7% MFU). Cosine shape is essential: it spends 70%+ of warmdown at very low LR enabling precise weight convergence. The model needs this extended low-LR phase despite being undertrained. Rules out sqrt warmdown shape
